Name,Description,Detail Page URL,Page
Canadian Organic Growers,Food Systems organization based in Ottawa ON Canada.,https://directories.onepercentfortheplanet.org/profile/canadian-organic-growers,1
Association pour la Recherche Therapeutique Anti-Cancereuse (ARTAC),Research against cancer based on environmental prevention. Focus: Toxics & Pollution.,https://directories.onepercentfortheplanet.org/profile/association-pour-la-recherche-therapeutique-anticancereuse-artac,1
Planned Parenthood League of Massachusetts,Provides access to sexual and reproductive health care and education. Focus: Climate Adaptation.,https://directories.onepercentfortheplanet.org/profile/planned-parenthood-league-of-massachusetts,1
Save A Turtle Inc.,Protects endangered sea turtles in the Florida Keys through conservation education and advocacy. Focus: Biodiversity & Wildlife.,https://directories.onepercentfortheplanet.org/profile/save-a-turtle-inc,1
Cheakamus Foundation for Environmental Learning,Operates Cheakamus Centre - a 165ha coastal rainforest ecological reserve in BC Canada offering environmental and indigenous cultural education.,https://directories.onepercentfortheplanet.org/profile/cheakamus-foundation-for-environmental-learning,1
Pacific Whale Foundation,Climate Adaptation focused organization in Wailuku HI.,https://directories.onepercentfortheplanet.org/profile/pacific-whale-foundation,1
Byron Bay Wildlife Sanctuary Operations,Biodiversity & Wildlife focused sanctuary in Knockrow New South Wales Australia.,https://directories.onepercentfortheplanet.org/profile/byron-bay-wildlife-sanctuary-operations,1
California Academy of Sciences,For over 165 years explores the natural world through exhibits research and education inspiring 1.3M visitors annually. Focus: Biodiversity & Wildlife.,https://directories.onepercentfortheplanet.org/profile/california-academy-of-sciences,1
Sacred Rok,Terrestrial Ecosystems focused organization in Redwood City CA.,https://directories.onepercentfortheplanet.org/profile/sacred-rok,1
Santa Catalina Island Conservancy,Terrestrial Ecosystems focused conservancy in Avalon CA.,https://directories.onepercentfortheplanet.org/profile/santa-catalina-island-conservancy,1
Faith in Place,Climate Adaptation focused organization in Chicago IL.,https://directories.onepercentfortheplanet.org/profile/faith-in-place,1
Forests for People,Empowering forest communities through education and sustainable livelihoods to protect forest resources. Focus: Environmental Education.,https://directories.onepercentfortheplanet.org/profile/forests-for-people,1
The Park People,Working with communities to plant trees and improve parks for a healthy resilient future in Denver CO.,https://directories.onepercentfortheplanet.org/profile/the-park-people,1
Friends of Griffith Park,Seeks to conserve the 4310-acre park as an irreplaceable urban wilderness in Los Angeles CA. Focus: Biodiversity & Wildlife.,https://directories.onepercentfortheplanet.org/profile/friends-of-griffith-park,1
California Center for Sustainable Energy,Climate Adaptation focused organization in San Diego CA.,https://directories.onepercentfortheplanet.org/profile/california-center-for-sustainable-energy,1
American River Conservancy,Land trust since 1989 protecting 28000 acres of riverfront habitats in the American River and Cosumnes River watersheds.,https://directories.onepercentfortheplanet.org/profile/american-river-conservancy,1
Vashon-Maury Island Land Trust,Land conservation organization preserving and restoring critical habitat for recreation education and science on Vashon Island WA.,https://directories.onepercentfortheplanet.org/profile/vashonmaury-island-land-trust,1
Terre Nourriciere,Climate Adaptation focused organization in Montpellier France.,https://directories.onepercentfortheplanet.org/profile/terre-nourriciere,1
Minnesota Waste Wise Foundation,Climate Adaptation focused organization in St. Paul MN.,https://directories.onepercentfortheplanet.org/profile/minnesota-waste-wise-foundation,1
Sarett Nature Center,Nature center focused on Biodiversity & Wildlife and environmental education in Benton Harbor MI.,https://directories.onepercentfortheplanet.org/profile/sarett-nature-center,1
JBay Surf Alliance,Marine Ecosystems focused organization in Jeffreys Bay South Africa.,https://directories.onepercentfortheplanet.org/profile/jbay-surf-alliance,2
Cabrillo National Monument Foundation,Essential partner to the National Park Service providing support to Cabrillo National Monument San Diego's only National Park.,https://directories.onepercentfortheplanet.org/profile/cabrillo-national-monument-foundation,2
Rozalia Project for a Clean Ocean,Focused on cleaning and protecting the ocean. Based in Burlington VT.,https://directories.onepercentfortheplanet.org/profile/rozalia-project-for-a-clean-ocean,2
Central Cross Country Skiing,Nature Access focused organization in Madison WI.,https://directories.onepercentfortheplanet.org/profile/central-cross-country-skiing,2
United Planet,Climate Adaptation focused organization in Boston MA.,https://directories.onepercentfortheplanet.org/profile/united-planet,2
The Black Girls Hike Foundation,Showcases the adventures of black women in the outdoor setting throughout all areas of the world. Based in Baltimore MD.,https://directories.onepercentfortheplanet.org/profile/the-black-girls-hike-foundation,2
San Luis Valley Great Outdoors,Builds pathways to connect to the outdoors. Based in Alamosa CO.,https://directories.onepercentfortheplanet.org/profile/san-luis-valley-great-outdoors,2
Mori wa Umi no Koibito,Works in forestation environmental education and preservation of natural environment in Kesennuma Japan.,https://directories.onepercentfortheplanet.org/profile/mori-wa-umi-no-koibito,2
Northwest Trail Alliance (NWTA),Advocates for new trails protects and builds sustainable mountain bike trails in Portland OR.,https://directories.onepercentfortheplanet.org/profile/northwest-trail-alliance-nwta,2
Lahaina Community Land Trust,Land & Water Rights focused organization in Lahaina HI.,https://directories.onepercentfortheplanet.org/profile/lahaina-community-land-trust,2
The Land Conservancy for Southern Chester County,Ensures perpetual preservation of open space natural resources historic sites and agricultural lands in Southern Chester County PA.,https://directories.onepercentfortheplanet.org/profile/the-land-conservancy-for-southern-chester-county,2
The Global Women's Project,Sustainable Livelihoods focused organization in Auburn South VIC Australia.,https://directories.onepercentfortheplanet.org/profile/the-global-womens-project,2
WWF France,One of the leading independent environmental protection organizations in the world. Based in Le Pré-Saint-Gervais France.,https://directories.onepercentfortheplanet.org/profile/wwf-france,2
World Monuments Fund,Private non-profit dedicated to saving and preserving important architectural and cultural heritage sites around the world.,https://directories.onepercentfortheplanet.org/profile/world-monuments-fund,2
Restore America's Estuaries,Committed to protecting and restoring bays and estuaries as essential resources for the nation. Based in Washington DC.,https://directories.onepercentfortheplanet.org/profile/restore-americas-estuaries,2
Cetus Research and Conservation Society,Facilitates conservation of the marine environment through community stewardship research and education. Based in Victoria BC.,https://directories.onepercentfortheplanet.org/profile/cetus-research-and-conservation-society,2
Climate Bridges,Women-led organization coordinating a network of partners dedicated to community-building and climate action. Based in Nyon Switzerland.,https://directories.onepercentfortheplanet.org/profile/climate-bridges,2
Monarch Butterfly Fund,Supports projects promoting habitat conservation research monitoring education and sustainable development in Mexico.,https://directories.onepercentfortheplanet.org/profile/monarch-butterfly-fund,2
Inclusive Outdoors Project,Nature Access focused organization in Bozeman MT.,https://directories.onepercentfortheplanet.org/profile/inclusive-outdoors-project,2
Wildlife Center of the North Coast,Wildlife rehabilitation and conservation education. Based in Astoria OR.,https://directories.onepercentfortheplanet.org/profile/wildlife-center-of-the-north-coast,2
Chatham Islands Taiko Trust,Community Conservation focused organization in Chatham Islands New Zealand.,https://directories.onepercentfortheplanet.org/profile/chatham-islands-taiko-trust,3
The Atmosphere Conservancy,Merging the environmental impact of clean energy with economic impact of cost savings. Based in Fort Collins CO.,https://directories.onepercentfortheplanet.org/profile/the-atmosphere-conservancy,3
Sustainable Lafeyette,Provides the community of Lafayette CA with information inspiration tools and assistance for sustainable practices.,https://directories.onepercentfortheplanet.org/profile/sustainable-lafeyette,3
The Manta Trust,Biodiversity & Wildlife focused organization in Dorchester England UK.,https://directories.onepercentfortheplanet.org/profile/the-manta-trust,3
Master Gardener Foundation of Washington State,Food Systems focused organization in Yakima WA.,https://directories.onepercentfortheplanet.org/profile/master-gardener-foundation-of-washington-state,3
Sustainable Tahoe,Creating and promoting sustainable adventures that inspire visitors to adopt principles of stewardship. Based in Incline Village NV.,https://directories.onepercentfortheplanet.org/profile/sustainable-tahoe,3
Futureproof Cumbria,Vision is a zero carbon greener Cumbria by 2037. Based in Penrith England UK.,https://directories.onepercentfortheplanet.org/profile/futureproof-cumbria,3
The Council for Responsible Sport,Climate Adaptation focused organization in Eugene OR.,https://directories.onepercentfortheplanet.org/profile/the-council-for-responsible-sport,3
Swim Drink Fish,Connecting people with water since 2001 through citizen science and communications technology. Based in Toronto ON.,https://directories.onepercentfortheplanet.org/profile/swim-drink-fish,3
Fraser River Discovery Centre Society,Non-profit dedicated to the largest salmon bearing river in North America. Based in New Westminster BC Canada.,https://directories.onepercentfortheplanet.org/profile/fraser-river-discovery-centre-society,3
Zero Waste France,Campaigns for waste reduction and better management of resources. Based in Paris France.,https://directories.onepercentfortheplanet.org/profile/zero-waste-france,3
Water is Basic,Empowers South Sudanese women to repair wells build cooperatives and end the water crisis. Based in Dallas TX.,https://directories.onepercentfortheplanet.org/profile/water-is-basic-1,3
FishAct,Conservation movement of volunteers aiming to preserve healthy oceans full of life. Based in Amsterdam Netherlands.,https://directories.onepercentfortheplanet.org/profile/fishact,3
Fraser Valley Conservancy,Protects and preserves land and watercourses with ecological and/or historical value. Based in Abbotsford BC Canada.,https://directories.onepercentfortheplanet.org/profile/fraser-valley-conservancy,3
California Trails Foundation,Nature Access focused organization in Forestville CA.,https://directories.onepercentfortheplanet.org/profile/california-trails-foundation,3
National Youth Bike Council,Sustainable Cities focused organization in East Norriton Township PA.,https://directories.onepercentfortheplanet.org/profile/national-youth-bike-council,3
Earth Law Center,Advancing the idea that ecosystems have the right to exist thrive and evolve. Based in Durango CO.,https://directories.onepercentfortheplanet.org/profile/earth-law-center,3
Sugar Pine Foundation (SPF),Forest restoration by planting white pines and other native tree species in the Lake Tahoe area CA.,https://directories.onepercentfortheplanet.org/profile/sugar-pine-foundation-spf,3
Trails Foundation Northern Utah,Non-profit trail building and maintenance foundation focused on community volunteer work and conservation. Based in Ogden UT.,https://directories.onepercentfortheplanet.org/profile/weber-pathways,3
4CORE (Four Corners Office for Resource Efficiency),Climate Adaptation focused organization in Durango CO.,https://directories.onepercentfortheplanet.org/profile/four-corners-office-for-resource-efficiency-4core,3
Smart Works Scotland,Sustainable Livelihoods focused organization in Edinburgh Scotland UK.,https://directories.onepercentfortheplanet.org/profile/smart-works-scotland,4
Somenos Marsh Wildlife Society,Steward of the Samuna/Somenos Conservation Area since 1986 preserving maintaining and enhancing sensitive ecosystems in Duncan BC.,https://directories.onepercentfortheplanet.org/profile/somenos-marsh-wildlife-society,4
Worcestershire Wildlife Trust,Biodiversity & Wildlife focused organization in Worcester England UK.,https://directories.onepercentfortheplanet.org/profile/worcestershire-wildlife-trust,4
Breathe Utah,Toxics & Pollution focused organization in Salt Lake City UT.,https://directories.onepercentfortheplanet.org/profile/breathe-utah,4
Fundación Sustentabilidad sin Fronteras,Argentine NGO driving evidence-based climate action and transparency with LATAM reach. Based in Buenos Aires Argentina.,https://directories.onepercentfortheplanet.org/profile/fundacin-sustentabilidad-sin-fronteras,4
Zharity,Committed to promoting social welfare of local and international families and communities in need. Based in Zurich Switzerland.,https://directories.onepercentfortheplanet.org/profile/zharity-1,4
Park City Conservation Association - Recycle Utah,501(c)(3) committed to reducing waste and preventing ground water pollution. Based in Park City UT.,https://directories.onepercentfortheplanet.org/profile/park-city-conservation-association-recycle-utah,4
ADABio,Association for the development of organic agriculture. Based in Ceyzeriat France.,https://directories.onepercentfortheplanet.org/profile/adabio,4
Bicycle Colorado,Vision of a Colorado where all people benefit from safe and accessible bicycling. Established in 1992.,https://directories.onepercentfortheplanet.org/profile/bicycle-colorado,4
Sierra Buttes Trail Stewardship,Revitalizing the Lost Sierra using trails as the tool. Based in Quincy CA.,https://directories.onepercentfortheplanet.org/profile/sierra-buttes-trail-stewardship,4
Naples Coalition,Terrestrial Ecosystems focused organization in Goleta CA.,https://directories.onepercentfortheplanet.org/profile/naples-coalition,4
Bicycle Alliance of Minnesota,Climate Adaptation focused organization in St. Paul MN.,https://directories.onepercentfortheplanet.org/profile/bicycle-alliance-of-minnesota,4
The International SeaKeepers Society,Facilitates oceanographic research conservation and education through involvement with the yachting community. Based in Coral Gables FL.,https://directories.onepercentfortheplanet.org/profile/the-international-seakeepers-society,4
Cottonwood Canyons Foundation,Terrestrial Ecosystems focused organization in Holladay UT.,https://directories.onepercentfortheplanet.org/profile/cottonwood-canyons-foundation,4
National Toxics Network Inc.,Toxics & Pollution focused organization in Bangalow NSW Australia.,https://directories.onepercentfortheplanet.org/profile/national-toxics-network-inc,4
Africa Clean Air Network,Collaboration platform uniting partners across borders to support clean air efforts across Africa. Based in Kampala Uganda.,https://directories.onepercentfortheplanet.org/profile/africa-clean-air-network,4
Un Arbol ONG,Non-profit working to regenerate ecosystems and strengthen community livelihoods through nature-based solutions in Argentina.,https://directories.onepercentfortheplanet.org/profile/un-arbol-ong,4
LUSH Valley Food Action Society,Vision of a region where nourishing local food is at the heart of community wellbeing. Based in Courtenay BC Canada.,https://directories.onepercentfortheplanet.org/profile/lush-valley-food-action-society,4
Ozark Natural Science Center (ONSC),Climate Adaptation focused organization in Huntsville AR.,https://directories.onepercentfortheplanet.org/profile/ozark-natural-science-center-onsc,4
Fundación Marejada,Uses films and science-based storytelling to support creation of marine and coastal protected areas. Based in Montevideo Uruguay.,https://directories.onepercentfortheplanet.org/profile/fundacin-marejada,4
Stream Restoration Alliance of the Middle Rogue,Freshwater Ecosystems focused organization in Grants Pass OR.,https://directories.onepercentfortheplanet.org/profile/stream-restoration-alliance-of-the-middle-rogue,5
Ishpingo,Climate Adaptation focused organization in Maisons Alfort France.,https://directories.onepercentfortheplanet.org/profile/ishpingo,5
Le Partenariat - Centre Gaia,International solidarity and citizenship education association fighting against inequalities. Based in Lille France.,https://directories.onepercentfortheplanet.org/profile/le-partenariat-centre-gaia,5
Nature Saskatchewan/SK.Natural History Society,Terrestrial Ecosystems focused organization in Regina SK Canada.,https://directories.onepercentfortheplanet.org/profile/nature-saskatchewansknatural-history-society,5
Oceanographic Teaching Stations - Roundhouse Aquarium,Connects visitors and students to the oceans and inspires marine conservation. Based in Manhattan Beach CA.,https://directories.onepercentfortheplanet.org/profile/oceanographic-teaching-stations-roundhouse-aquarium,5
Watershed Sentinel,Freshwater Ecosystems focused organization on Cortes Island BC Canada.,https://directories.onepercentfortheplanet.org/profile/watershed-sentinel,5
Colorado Fourteeners Initiative,Partners with US Forest Service to protect Colorados 14er ecosystems through sustainable hiking routes education and trail restoration.,https://directories.onepercentfortheplanet.org/profile/colorado-fourteeners-initiative,5
Southern Environmental Law Center,Works to create strengthen and enforce environmental laws and policies across the Southern US. Based in Charlottesville VA.,https://directories.onepercentfortheplanet.org/profile/southern-environmental-law-center,5
Young Naturalists Club (Nova Scotia),Immersive nature club for youth and families teaching naturalist skills and exploring Nova Scotias wild spaces.,https://directories.onepercentfortheplanet.org/profile/young-naturalists-club-nova-scotia,5
Wild Trails,Climate Adaptation focused organization in Chattanooga TN.,https://directories.onepercentfortheplanet.org/profile/wild-trails,5
Regional Environmental Council Inc. (REC),Creating a just food system together. Based in Worcester MA.,https://directories.onepercentfortheplanet.org/profile/regional-environmental-council-inc-rec,5
Vermont Energy Investment Corporation (VEIC),Climate Adaptation focused organization in Burlington VT.,https://directories.onepercentfortheplanet.org/profile/vermont-energy-investment-corporation-veic,5
Sound Rivers,Guards the health of the Neuse and Tar-Pamlico river basins covering nearly one-quarter of NC.,https://directories.onepercentfortheplanet.org/profile/sound-rivers,5
LifeCycles Project Society,Food Systems focused organization in Victoria BC Canada.,https://directories.onepercentfortheplanet.org/profile/lifecycles-project-society,5
Sutter Buttes Regional Land Trust,Protects natural and agricultural resources of the Sutter Buttes region for present and future generations. Based in Yuba City CA.,https://directories.onepercentfortheplanet.org/profile/sutter-buttes-regional-land-trust,5
Rogue Farm Corps,Food Systems focused organization in Ashland OR.,https://directories.onepercentfortheplanet.org/profile/rogue-farm-corps,5
Central Caribbean Marine Institute (CCMI),Freshwater Ecosystems focused organization in Princeton NJ.,https://directories.onepercentfortheplanet.org/profile/central-caribbean-marine-institute-ccmi,5
Ojai Valley Defense Fund,Toxics & Pollution focused organization in Ojai CA.,https://directories.onepercentfortheplanet.org/profile/ojai-valley-defense-fund,5
New Energy Economy,Promotes a 100% renewable energy future through strategic intervention. Based in Santa Fe NM.,https://directories.onepercentfortheplanet.org/profile/new-energy-economy,5
Fundación Cordillera Tropical,Conservation nonprofit operating in the Amazon headwaters of Ecuador demonstrating conservation through private landowner engagement.,https://directories.onepercentfortheplanet.org/profile/fundacin-cordillera-tropical,5
UK Overseas Territories Conservation Forum,Promotes coordinated conservation of species and ecosystems across UK Overseas Territories and Crown Dependencies.,https://directories.onepercentfortheplanet.org/profile/uk-overseas-territories-conservation-forum,6
Advocates for the West,Public interest nonprofit environmental law firm protecting and defending the West's natural treasures and wildlife.,https://directories.onepercentfortheplanet.org/profile/advocates-for-the-west,6
Friends of Tryon Creek State Park,Terrestrial Ecosystems focused organization in Portland OR.,https://directories.onepercentfortheplanet.org/profile/friends-of-tryon-creek-state-park,6
Louisiana Environmental Action Network,Community-based organization working since 1986 to resolve environmental struggles in Louisiana through education and advocacy.,https://directories.onepercentfortheplanet.org/profile/louisiana-environmental-action-network,6
Green Camel Bell,Freshwater Ecosystems focused organization in Lanzhou Gansu China.,https://directories.onepercentfortheplanet.org/profile/green-camel-bell,6
Rob Machado Foundation,Educates and empowers young people to make sustainable choices. Based in CA.,https://directories.onepercentfortheplanet.org/profile/rob-machado-foundation,6
1000 Friends of Oregon,Uses litigation legislation and land use leadership to protect Oregon's farm ranch and forestland.,https://directories.onepercentfortheplanet.org/profile/1000-friends-of-oregon,6
Ojai Valley Green Coalition,Advancing a sustainable and resilient Ojai Valley through community programs including plastic bag bans ride sharing and clean-ups.,https://directories.onepercentfortheplanet.org/profile/ojai-valley-green-coalition,6
Rocky Mountain Youth Corps (New Mexico),Terrestrial Ecosystems focused organization in Taos NM.,https://directories.onepercentfortheplanet.org/profile/rocky-mountain-youth-corps-new-mexico,6
South Georgia Heritage Trust (SGHT),Terrestrial Ecosystems focused organization in Dundee Scotland UK.,https://directories.onepercentfortheplanet.org/profile/south-georgia-heritage-trust-sght,6
Virginia Wilderness Committee,Terrestrial Ecosystems focused organization in Harrisonburg VA.,https://directories.onepercentfortheplanet.org/profile/virginia-wilderness-committee,6
Prickly Pear Land Trust,Preserves and protects rural character of the Prickly Pear Valley and connects people to natural surroundings. Based in Helena MT.,https://directories.onepercentfortheplanet.org/profile/prickly-pear-land-trust,6
UCSB Environmental Studies Department,Climate Adaptation focused organization in Santa Barbara CA.,https://directories.onepercentfortheplanet.org/profile/ucsb-environmental-studies-department,6
Utahns For Better Transportation,Climate Adaptation focused organization in Salt Lake City UT.,https://directories.onepercentfortheplanet.org/profile/utahns-for-better-transportation,6
Virginians for Wilderness,Terrestrial Ecosystems focused organization in Staunton VA.,https://directories.onepercentfortheplanet.org/profile/virginians-for-wilderness,6
Western Canada Wilderness Committee,Working for over 40 years to protect biological diversity in Canada. Based in Vancouver BC.,https://directories.onepercentfortheplanet.org/profile/western-canada-wilderness-committee,6
Transportation Riders United,Climate Adaptation focused organization in Detroit MI.,https://directories.onepercentfortheplanet.org/profile/transportation-riders-united,6
New Haven Inspiring Connections Outdoors (ICO),Terrestrial Ecosystems focused organization in Branford CT.,https://directories.onepercentfortheplanet.org/profile/new-haven-inspiring-connections-outdoors-ico,6
Spirit of the Sage Council,Terrestrial Ecosystems focused organization in Fayetteville NC.,https://directories.onepercentfortheplanet.org/profile/spirit-of-the-sage-council,6
The Potomac Conservancy,Freshwater Ecosystems focused organization in Silver Spring MD.,https://directories.onepercentfortheplanet.org/profile/the-potomac-conservancy,6
Valley Advocates for Responsible Development,Terrestrial Ecosystems focused organization in Driggs ID.,https://directories.onepercentfortheplanet.org/profile/valley-advocates-for-responsible-development,7
The Association to Preserve Cape Cod,Cape Cod's leading nonprofit environmental organization working to protect natural resources and quality of life since 1968.,https://directories.onepercentfortheplanet.org/profile/the-association-to-preserve-cape-cod,7
The Native Plant Center,Climate Adaptation focused organization in Valhalla NY.,https://directories.onepercentfortheplanet.org/profile/the-native-plant-center,7
Les Amis de la Terre France,Working daily for environmental protection and human rights. Based in Montreuil France.,https://directories.onepercentfortheplanet.org/profile/les-amis-de-la-terre-france,7
Village Focus International,Climate Adaptation focused organization in Phnom Penh Cambodia.,https://directories.onepercentfortheplanet.org/profile/village-focus-international,7
Swedish Society for Nature Conservation (SSNC) - Naturskyddsforeningen,Climate Adaptation focused organization in Stockholm Sweden.,https://directories.onepercentfortheplanet.org/profile/swedish-society-for-nature-conservation-ssnc-naturskyddsforeningen,7
Union of Concerned Scientists,Climate Adaptation focused organization in Cambridge MA.,https://directories.onepercentfortheplanet.org/profile/union-of-concerned-scientists,7
