Name,Description,Detail Page URL,Page
The Sierra Fund,Toxics & Pollution focused organization in Nevada City CA.,https://directories.onepercentfortheplanet.org/profile/the-sierra-fund,7
Sustainable Conservation,Climate Adaptation focused organization in San Francisco CA.,https://directories.onepercentfortheplanet.org/profile/sustainable-conservation,7
West Michigan Air & Waste Management Association,Climate Adaptation focused organization in Ada MI.,https://directories.onepercentfortheplanet.org/profile/west-michigan-air-waste-management-association,7
The Ocean Foundation,Marine Ecosystems focused organization in Washington DC.,https://directories.onepercentfortheplanet.org/profile/the-ocean-foundation,7
Triune Arts,Climate Adaptation focused organization in Kemptville ON Canada.,https://directories.onepercentfortheplanet.org/profile/triune-arts,7
The Wetlands Institute,Freshwater Ecosystems focused organization in Stone Harbor NJ.,https://directories.onepercentfortheplanet.org/profile/the-wetlands-institute,7
Valley Floor Preservation Partners,Terrestrial Ecosystems focused organization in Telluride CO.,https://directories.onepercentfortheplanet.org/profile/valley-floor-preservation-partners,7
Sweetwater Alliance,Freshwater Ecosystems focused organization in Duluth MN.,https://directories.onepercentfortheplanet.org/profile/sweetwater-alliance,7
Windustry,Climate Adaptation focused organization in Minneapolis MN.,https://directories.onepercentfortheplanet.org/profile/windustry,7
The International Polar Foundation,Climate Adaptation focused organization in Brussels Belgium.,https://directories.onepercentfortheplanet.org/profile/the-international-polar-foundation,7
Asaza Fund,Freshwater Ecosystems focused organization in Ushiku-shi Ibaraki Japan.,https://directories.onepercentfortheplanet.org/profile/asaza-fund,7
Nectandra Institute,Freshwater Ecosystems focused organization in San Ramon Alajuela Costa Rica.,https://directories.onepercentfortheplanet.org/profile/nectandra-institute,7
Citizens Planning Foundation,Terrestrial Ecosystems focused organization in Santa Barbara CA.,https://directories.onepercentfortheplanet.org/profile/citizens-planning-foundation,7
Trout Unlimited - Wyoming,Freshwater Ecosystems focused organization in Lander WY.,https://directories.onepercentfortheplanet.org/profile/trout-unlimited-wyoming,8
Crag Law Center,Provides free and low-cost legal services to protect communities wild places and climate. Based in Portland OR.,https://directories.onepercentfortheplanet.org/profile/crag-law-center,8
Paddle Without Pollution,Freshwater Ecosystems focused organization in Pittsburgh PA.,https://directories.onepercentfortheplanet.org/profile/paddle-without-pollution,8
Ocean Defenders Alliance,Fills the void in marine conservation by physically removing ghost gear and marine debris from oceans. Based in Huntington Beach CA.,https://directories.onepercentfortheplanet.org/profile/ocean-defenders-alliance,8
Our Children's Trust (OCT),Global legal team supporting youth-led climate litigation campaigns. Based in Eugene OR.,https://directories.onepercentfortheplanet.org/profile/our-childrens-trust-oct,8
Australian Marine Conservation Society Inc.,The voice for Australia's oceans. Based in West End QLD Australia.,https://directories.onepercentfortheplanet.org/profile/australian-marine-conservation-society-inc,8
Friends of the Mississippi River,Freshwater Ecosystems focused organization in Saint Paul MN.,https://directories.onepercentfortheplanet.org/profile/friends-of-the-mississippi-river,8
Monadnock Conservancy,Terrestrial Ecosystems focused organization in Keene NH.,https://directories.onepercentfortheplanet.org/profile/monadnock-conservancy,8
Haywood Waterways Association,Freshwater Ecosystems focused organization in Waynesville NC.,https://directories.onepercentfortheplanet.org/profile/haywood-waterways-association,8
Greenbelt: Essex County's Land Trust,Climate Adaptation focused land trust in Essex MA.,https://directories.onepercentfortheplanet.org/profile/greenbelt-essex-county-land-trust,8
Agriculture and Land-Based Training Association,Trains immigrant farmworkers to transition to organic farm ownership. Based in Salinas CA.,https://directories.onepercentfortheplanet.org/profile/agriculture-and-landbased-training-association,8
Buzzards Bay Coalition,Freshwater Ecosystems focused organization in New Bedford MA.,https://directories.onepercentfortheplanet.org/profile/buzzards-bay-coalition,8
Resurrection Bay Conservation Alliance,Small organization addressing threats to local habitats and wildlife since the mid 1990s. Based in Seward AK.,https://directories.onepercentfortheplanet.org/profile/resurrection-bay-conservation-alliance,8
Trout Unlimited - Mountain Laurel Chapter,Biodiversity & Wildlife focused organization in Johnstown PA.,https://directories.onepercentfortheplanet.org/profile/trout-unlimited-mountain-laurel-chapter,8
Apalachicola Riverkeeper,Fighting for the protection and restoration of the Apalachicola River and Bay since 1998.,https://directories.onepercentfortheplanet.org/profile/apalachicola-riverkeeper,8
Atlas Cultural Foundation,Climate Adaptation focused organization in Bozeman MT.,https://directories.onepercentfortheplanet.org/profile/atlas-cultural-foundation,8
Community Environmental Legal Defense Fund,Non-profit law firm assisting communities develop groundbreaking laws to protect rights. Based in Mercersburg PA.,https://directories.onepercentfortheplanet.org/profile/community-environmental-legal-defense-fund,8
Anza-Borrego Foundation,Terrestrial Ecosystems focused organization in Borrego Springs CA.,https://directories.onepercentfortheplanet.org/profile/anzaborrego-foundation,8
Humane Society Wildlife Land Trust (WLT),Terrestrial Ecosystems focused organization in Gaithersburg MD.,https://directories.onepercentfortheplanet.org/profile/humane-society-wildlife-land-trust-wlt,8
Yosemite Climbing Association,Preserves the history of climbing in Yosemite and promotes stewardship of public lands. Based in Mariposa CA.,https://directories.onepercentfortheplanet.org/profile/yosemite-climbing-association,8
Appalachian Sustainable Agriculture Project (ASAP),Food Systems focused organization in Asheville NC.,https://directories.onepercentfortheplanet.org/profile/appalachian-sustainable-agriculture-project-asap,9
Bike Walk Connecticut,Climate Adaptation focused organization in West Hartford CT.,https://directories.onepercentfortheplanet.org/profile/bike-walk-connecticut,9
Big Run Wolf Ranch,Climate Adaptation focused organization in Lockport IL.,https://directories.onepercentfortheplanet.org/profile/big-run-wolf-ranch,9
Oceanic Research Group,Freshwater Ecosystems focused organization in North Reading MA.,https://directories.onepercentfortheplanet.org/profile/oceanic-research-group,9
NORDESTA Reforestation & Education,Freshwater Ecosystems focused organization in Geneva Switzerland.,https://directories.onepercentfortheplanet.org/profile/nordesta-reforestation-education,9
Pescadero Conservation Alliance,Freshwater Ecosystems focused organization in Pescadero CA.,https://directories.onepercentfortheplanet.org/profile/pescadero-conservation-alliance,9
Tahoe Area Mountain Biking Association (TAMBA),Dedicated to stewardship of sustainable multiple-use trails through advocacy education and promotion. Based in Lake Tahoe CA.,https://directories.onepercentfortheplanet.org/profile/tahoe-area-mountain-biking-association-tamba,9
Cascade Bicycle Club,Vision of a future where bicycles bring people together eliminate inequity and create thriving communities. Based in Seattle WA.,https://directories.onepercentfortheplanet.org/profile/cascade-bicycle-club,9
The Rainforest Conservation Fund,Terrestrial Ecosystems focused organization in Chicago IL.,https://directories.onepercentfortheplanet.org/profile/the-rainforest-conservation-fund,9
Sustainable Coastlines Hawaii,Toxics & Pollution focused organization in Honolulu HI.,https://directories.onepercentfortheplanet.org/profile/sustainable-coastlines-hawaii,9
The Earth Organization - TEO,Terrestrial Ecosystems focused organization in Toluca Lake CA.,https://directories.onepercentfortheplanet.org/profile/the-earth-organization-teo,9
Vermont Fresh Network,Food Systems focused organization in Richmond VT.,https://directories.onepercentfortheplanet.org/profile/vermont-fresh-network,9
California Climate and Agriculture Network (CalCAN),Climate Adaptation focused organization in Sebastopol CA.,https://directories.onepercentfortheplanet.org/profile/california-climate-and-agriculture-network-calcan,9
Feather River Land Trust,Terrestrial Ecosystems focused organization in Quincy CA.,https://directories.onepercentfortheplanet.org/profile/feather-river-land-trust,9
Persian Wildlife Heritage Foundation,Biodiversity & Wildlife focused organization in Tehran Iran.,https://directories.onepercentfortheplanet.org/profile/persian-wildlife-heritage-foundation,9
Tahoe Institute for Natural Science,Promotes appreciation understanding and stewardship of the natural resources of the Lake Tahoe region.,https://directories.onepercentfortheplanet.org/profile/tahoe-institute-for-natural-science,9
New York Sun Works,Brings hydroponic technology to schools to teach sustainability science and climate education. Based in New York NY.,https://directories.onepercentfortheplanet.org/profile/new-york-sun-works,9
The Renewable Resources Foundation,Freshwater Ecosystems focused organization in Anchorage AK.,https://directories.onepercentfortheplanet.org/profile/the-renewable-resources-foundation,9
Mizumiyama No Midori To Mizu Wo Mamoru Kai,Terrestrial Ecosystems focused organization in Tokyo Japan.,https://directories.onepercentfortheplanet.org/profile/mizumiyama-no-midori-to-mizu-wo-mamoru-kai,9
Carrboro Bicycle Coalition,Climate Adaptation focused organization in Carrboro NC.,https://directories.onepercentfortheplanet.org/profile/carrboro-bicycle-coalition,9
Minnesota Land Trust,Freshwater Ecosystems focused organization in St. Paul MN.,https://directories.onepercentfortheplanet.org/profile/minnesota-land-trust,10
Initiatives de Developpement Strategique (I.D.S),Toxics & Pollution focused organization in Rillieux-la-Pape France.,https://directories.onepercentfortheplanet.org/profile/initiatives-de-dveloppement-stratgique-ids,10
Environmental Travel Companions,Makes outdoor adventures accessible to people with disabilities and under-resourced youth. Based in San Francisco CA.,https://directories.onepercentfortheplanet.org/profile/environmental-travel-companions,10
Ashland Woodlands and Trails Association,Terrestrial Ecosystems focused organization in Ashland OR.,https://directories.onepercentfortheplanet.org/profile/ashland-woodlands-and-trails-association,10
Rural Advancement Foundation International-USA (RAFI-USA),Supports and advocates for economically racially and ecologically just farm communities. Based in Pittsboro NC.,https://directories.onepercentfortheplanet.org/profile/rural-advancement-foundation-internationalusa-rafiusa,10
Nevada Land Trust,Terrestrial Ecosystems focused organization in Reno NV.,https://directories.onepercentfortheplanet.org/profile/nevada-land-trust,10
Vermont Green Building Network,Working towards ensuring all Vermont residents have green healthy spaces to live work and play.,https://directories.onepercentfortheplanet.org/profile/vermont-green-building-network,10
John Muir Land Trust,Terrestrial Ecosystems focused organization in Martinez CA.,https://directories.onepercentfortheplanet.org/profile/john-muir-land-trust,10
CRIIGEN,Committee for Independent Research and Information on Genetic Engineering assessing risks of GMOs and pesticides. Based in Poitiers France.,https://directories.onepercentfortheplanet.org/profile/criigen,10
CicLAvia,501(c)(3) that catalyzes vibrant public spaces active transportation and good health through car-free streets. Based in Los Angeles CA.,https://directories.onepercentfortheplanet.org/profile/ciclavia,10
Garfield Park Conservatory Alliance,Climate Adaptation focused organization in Chicago IL.,https://directories.onepercentfortheplanet.org/profile/garfield-park-conservatory-alliance,10
New Hampshire Rivers Council,Ecologically sound management of New Hampshires rivers watersheds and related natural resources. Based in Concord NH.,https://directories.onepercentfortheplanet.org/profile/new-hampshire-rivers-council,10
The Whale Museum,Promotes stewardship of whales and the Salish Sea ecosystem through education and research. Based in Friday Harbor WA.,https://directories.onepercentfortheplanet.org/profile/the-whale-museum,10
City Sprouts,Food Systems focused organization in Omaha NE.,https://directories.onepercentfortheplanet.org/profile/city-sprouts,10
Lake Pend Oreille Waterkeeper (LPOW),Freshwater Ecosystems focused organization in Sandpoint ID.,https://directories.onepercentfortheplanet.org/profile/lake-pend-oreille-waterkeeper-lpow,10
Ausable Freshwater Center,Building a better future for Adirondack communities through science-based freshwater stewardship. Based in Wilmington NY.,https://directories.onepercentfortheplanet.org/profile/ausable-river-association,10
Fondation Monique-Fitz-Back pour leducation au developpement durable,Climate Adaptation focused educational foundation in Quebec QC Canada.,https://directories.onepercentfortheplanet.org/profile/fondation-moniquefitzback-pour-lducation-au-dveloppement-durable,10
Mosquito Range Heritage Initiative,Terrestrial Ecosystems focused organization in Alma CO.,https://directories.onepercentfortheplanet.org/profile/mosquito-range-heritage-initiative,10
Its Time Foundation,Provides clean free solar energy for lighting and computers to island schools. Based in Corrimal NSW Australia.,https://directories.onepercentfortheplanet.org/profile/its-time-foundation,10
Power2Sustain,Environmental literacy project teaching and empowering K-12 students to sustain their natural world. Based in Santa Cruz CA.,https://directories.onepercentfortheplanet.org/profile/power2sustain,10